Paper Title,Subarea,Detailed Class,Score
Predictive Preference Learning from Human Interventions,Capability Control & Unlearning,Alignment Training,4.0
AgentBreeder: Mitigating the AI Safety Risks of Multi-Agent Scaffolds via Self-Improvement,Scalable Oversight & Value Learning,Multi-Agent Safety,7.0
BadVLA: Towards Backdoor Attacks on Vision-Language-Action Models via Objective-Decoupled Optimization,"Robustness, Defense & Systemic Control",Red-Teaming,7.0
Boundary-to-Region Supervision for Offline Safe Reinforcement Learning,Capability Control & Unlearning,Alignment Training,7.0
Enhancing Safety in Reinforcement Learning with Human Feedback via Rectified Policy Optimization,Capability Control & Unlearning,Alignment Training,7.0
Steering When Necessary: Flexible Steering Large Language Models with Backtracking,Threat Modeling & Evaluations,Safeguards,6.0
Leveraging robust optimization for llm alignment under distribution shifts,Capability Control & Unlearning,Alignment Training,5.0
Training-Free Safe Denoisers for Safe Use of Diffusion Models,Threat Modeling & Evaluations,Safeguards,7.0
Predicting the Performance of Black-box Language Models with Follow-up Queries,Interpretability & Understanding,Monitoring,6.0
Pairwise Calibrated Rewards for Pluralistic Alignment,Scalable Oversight & Value Learning,Scalable Oversight,6.0
Superposition Yields Robust Neural Scaling,Interpretability & Understanding,Interpretability,3.0
From Sequence to Structure: Uncovering Substructure Reasoning in Transformers,Interpretability & Understanding,Interpretability,4.0
CURE: Concept Unlearning via Orthogonal Representation Editing in Diffusion Models,Capability Control & Unlearning,Alignment Training,7.0
On the Mechanisms of Weak-to-Strong Generalization: A Theoretical Perspective,Scalable Oversight & Value Learning,Scalable Oversight,4.0
SafePTR: Token-Level Jailbreak Defense in Multimodal LLMs via Prune-then-Restore Mechanism,Threat Modeling & Evaluations,Safeguards,7.0
Enhancing CLIP Robustness via Cross-Modality Alignment,"Robustness, Defense & Systemic Control",Adversarial Robustness,5.0
ICLScan: Detecting Backdoors in Black-Box Large Language Models via Targeted In-context Illumination,"Robustness, Defense & Systemic Control",Adversarial Robustness,7.0
Attractive Metadata Attack: Inducing LLM Agents to Invoke Malicious Tools,"Robustness, Defense & Systemic Control",Red-Teaming,7.0
EAP-GP: Mitigating Saturation Effect in Gradient-based Automated Circuit Identification,Interpretability & Understanding,Interpretability,5.0
Image Token Matters: Mitigating Hallucination in Discrete Tokenizer-based Large Vision-Language Models via Latent Editing,Interpretability & Understanding,Interpretability,4.0
Overcoming Sparsity Artifacts in Crosscoders to Interpret Chat-Tuning,Interpretability & Understanding,Interpretability,5.0
Hierarchical Frequency Tagging Probe (HFTP): A Unified Approach to Investigate Syntactic Structure Representations in Large Language Models and the Human Brain,Interpretability & Understanding,Interpretability,3.0
EraseFlow: Learning Concept Erasure Policies via GFlowNet-Driven Alignment,Capability Control & Unlearning,Alignment Training,6.0
Lie Detector: Unified Backdoor Detection via Cross-Examination Framework,"Robustness, Defense & Systemic Control",Adversarial Robustness,7.0
GUARDIAN: Safeguarding LLM Multi-Agent Collaborations with Temporal Graph Modeling,Scalable Oversight & Value Learning,Multi-Agent Safety,6.0
Scalable Valuation of Human Feedback through Provably Robust Model Alignment,Capability Control & Unlearning,Alignment Training,6.0
When Thinking Fails: The Pitfalls of Reasoning for Instruction-Following in LLMs,Interpretability & Understanding,Interpretability,4.0
Adversarial Attacks against Closed-Source MLLMs via Feature Optimal Alignment,"Robustness, Defense & Systemic Control",Red-Teaming,4.0
"Same Task, Different Circuits: Disentangling Modality-Specific Mechanisms in VLMs",Interpretability & Understanding,Interpretability,3.0
VLMs can Aggregate Scattered Training Patches,"Robustness, Defense & Systemic Control",Red-Teaming,6.0
Elastic Robust Unlearning of Specific Knowledge in Large Language Models,Capability Control & Unlearning,Alignment Training,6.0
CoP: Agentic Red-teaming for Large Language Models using Composition of Principles,"Robustness, Defense & Systemic Control",Red-Teaming,7.0
Unlearned but Not Forgotten: Data Extraction after Exact Unlearning in LLM,"Robustness, Defense & Systemic Control",Red-Teaming,7.0
Towards Building Model/Prompt-Transferable Attackers against Large Vision-Language Models,"Robustness, Defense & Systemic Control",Red-Teaming,6.0
Who Reasons in the Large Language Models?,Interpretability & Understanding,Interpretability,4.0
CARE: Decoding-Time Safety Alignment via Rollback and Introspection Intervention,Threat Modeling & Evaluations,Safeguards,7.0
LLM Interpretability with Identifiable Temporal-Instantaneous Representation,Interpretability & Understanding,Interpretability,5.0
Provably Efficient RL under Episode-Wise Safety in Constrained MDPs with Linear Function Approximation,Agent Foundations & Alignment Theory,Agent Foundations,4.0
Large Language Models Think Too Fast To Explore Effectively,Interpretability & Understanding,Interpretability,3.0
Context-Aware Hierarchical Learning: A Two-Step Paradigm towards Safer LLMs,"Robustness, Defense & Systemic Control",Adversarial Robustness,7.0
MIP against Agent: Malicious Image Patches Hijacking Multimodal OS Agents,"Robustness, Defense & Systemic Control",Red-Teaming,6.0
Learning to Steer: Input-dependent Steering for Multimodal LLMs,Threat Modeling & Evaluations,Safeguards,7.0
Who Speaks for the Trigger? Dynamic Expert Routing in Backdoored Mixture-of-Experts Transformers,"Robustness, Defense & Systemic Control",Red-Teaming,5.0
LARGO: Latent Adversarial Reflection through Gradient Optimization for Jailbreaking LLMs,"Robustness, Defense & Systemic Control",Red-Teaming,7.0
Scaling Laws For Scalable Oversight,Scalable Oversight & Value Learning,Scalable Oversight,7.0
Towards Interpretability Without Sacrifice: Faithful Dense Layer Decomposition with Mixture of Decoders,Interpretability & Understanding,Interpretability,6.0
Measuring and Guiding Monosemanticity,Interpretability & Understanding,Interpretability,6.0
Concept-Guided Interpretability via Neural Chunking,Interpretability & Understanding,Interpretability,6.0
Exploring Data Scaling Trends and Effects in Reinforcement Learning from Human Feedback,Capability Control & Unlearning,Alignment Training,4.0
Strategyproof Reinforcement Learning from Human Feedback,Scalable Oversight & Value Learning,Scalable Oversight,5.0
Red-Teaming Text-to-Image Systems by Rule-based Preference Modeling,"Robustness, Defense & Systemic Control",Red-Teaming,7.0
Cognitive Mirrors: Exploring the Diverse Functional Roles of Attention Heads in LLM Reasoning,Interpretability & Understanding,Interpretability,3.0
FALCON: Fine-grained Activation Manipulation by Contrastive Orthogonal Unalignment for Large Language Model,Capability Control & Unlearning,Alignment Training,7.0
Detoxifying Large Language Models via Autoregressive Reward Guided Representation Editing,Threat Modeling & Evaluations,Safeguards,6.0
Can DPO Learn Diverse Human Values? A Theoretical Scaling Law,Scalable Oversight & Value Learning,Scalable Oversight,5.0
T2V-OptJail: Discrete Prompt Optimization for Text-to-Video Jailbreak Attacks,"Robustness, Defense & Systemic Control",Red-Teaming,7.0
Continuous Concepts Removal in Text-to-image Diffusion Models,Capability Control & Unlearning,Alignment Training,5.0
Language Models Can Predict Their Own Behavior,Interpretability & Understanding,Monitoring,6.0
Shape it Up! Restoring LLM Safety during Finetuning,Capability Control & Unlearning,Alignment Training,7.0
RULE: Reinforcement UnLEarning Achieves Forget-retain Pareto Optimality,Capability Control & Unlearning,Alignment Training,6.0
Safety Depth in Large Language Models: A Markov Chain Perspective,Threat Modeling & Evaluations,Safeguards,7.0
Mitigating Sexual Content Generation via Embedding Distortion in Text-conditioned Diffusion Models,"Robustness, Defense & Systemic Control",Adversarial Robustness,7.0
Do different prompting methods yield a common task representation in language models?,Interpretability & Understanding,Interpretability,3.0
On the Robustness of Transformers against Context Hijacking for Linear Classification,"Robustness, Defense & Systemic Control",Adversarial Robustness,3.0
AgentAuditor: Human-level Safety and Security Evaluation for LLM Agents,Threat Modeling & Evaluations,Dangerous Capability Evals,6.0
Fit the Distribution: Cross-Image/Prompt Adversarial Attacks on Multimodal Large Language Models,"Robustness, Defense & Systemic Control",Red-Teaming,7.0
Interpreting vision transformers via residual replacement model,Interpretability & Understanding,Interpretability,4.0
The Mirage of Performance Gains: Why Contrastive Decoding Fails to Mitigate Object Hallucinations in MLLMs?,Threat Modeling & Evaluations,Safeguards,6.0
Rectifying Shortcut Behaviors in Preference-based Reward Learning,Capability Control & Unlearning,Alignment Training,7.0
SeCon-RAG: A Two-Stage Semantic  Filtering and Conflict-Free Framework for Trustworthy RAG,"Robustness, Defense & Systemic Control",Adversarial Robustness,7.0
Unified Multimodal Chain-of-Thought Reward Model through Reinforcement Fine-Tuning,Capability Control & Unlearning,Alignment Training,5.0
WMCopier: Forging Invisible Watermarks on Arbitrary Images,"Robustness, Defense & Systemic Control",Red-Teaming,3.0
Stackelberg Self-Annotation: A Robust Approach to Data-Efficient LLM Alignment,Capability Control & Unlearning,Alignment Training,4.0
Vision Function Layer in Multimodal LLMs,Interpretability & Understanding,Interpretability,4.0
Robust SuperAlignment: Weak-to-Strong Robustness Generalization for Vision-Language Models,Scalable Oversight & Value Learning,Scalable Oversight,6.0
"More Thinking, Less Seeing? Assessing Amplified Hallucination in Multimodal Reasoning Models",Interpretability & Understanding,Interpretability,5.0
The Future Unmarked: Watermark Removal in AI-Generated Images via Next-Frame Prediction,"Robustness, Defense & Systemic Control",Red-Teaming,7.0
RiOSWorld: Benchmarking the Risk of Multimodal Computer-Use Agents,Threat Modeling & Evaluations,Dangerous Capability Evals,7.0
Interpreting Arithmetic Reasoning in Large Language Models using Game-Theoretic Interactions,Interpretability & Understanding,Interpretability,3.0
"Adjacent Words, Divergent Intents: Jailbreaking Large Language Models via Task Concurrency","Robustness, Defense & Systemic Control",Red-Teaming,7.0
Backdoor Cleaning without External Guidance in MLLM Fine-tuning,"Robustness, Defense & Systemic Control",Adversarial Robustness,7.0
Why and How LLMs Hallucinate: Connecting the Dots with Subsequence Associations,Interpretability & Understanding,Interpretability,5.0
Adaptive Defense against Harmful Fine-Tuning for Large Language Models via Bayesian Data Scheduler,Capability Control & Unlearning,Alignment Training,7.0
Erasing Conceptual Knowledge from Language Models,Capability Control & Unlearning,Alignment Training,7.0
SECA: Semantically Equivalent and Coherent Attacks for Eliciting LLM Hallucinations,"Robustness, Defense & Systemic Control",Adversarial Robustness,5.0
What Makes a Reward Model a Good Teacher? An Optimization Perspective,Capability Control & Unlearning,Alignment Training,6.0
From Judgment to Interference: Early Stopping LLM Harmful Outputs via Streaming Content Monitoring,Threat Modeling & Evaluations,Safeguards,7.0
