id,title,abstract,stratum,tfidf_proba,tfidf_pred
2605.27678,Heterogeneous Parallelism for Multimodal Large Language Model Training,"Foundation model training is becoming multimodal, from post-training pipelines to large-scale pretraining. As modality coverage broadens, context windows grow, and encoder LLM scales diverge, a single LLM-centric TP/CP/PP/DP/EP layout increasingly limits throughput. This coupling forces encoders to inherit LLM-driven sharding and placement choices that can add communication, limit encoder parallelism, or constrain the LLM schedule; the mismatch is most pronounced at long contexts, where LLM context parallelism is needed for the fused multimodal sequence but encoder inputs remain bounded. We present heterogeneous parallelism for multimodal large language model training, an abstraction that lets modules in one end-to-end graph use independent layouts and rank placements, supporting colocated execution on shared GPUs and non-colocated execution on disjoint rank sets. The key challenge is preserving boundary tensor semantics across independent layouts: forward activations must be materialized for the destination layout, while backward gradients must be routed back to the source layout. We address this with boundary communicators that implement forward and backward layout transforms, plus scheduling extensions for both placement modes. We evaluate optimized homogeneous, colocated heterogeneous, and non-colocated heterogeneous configurations across multimodal workloads and GPU scales to characterize when added layout and placement freedom exposes a better operating point. Across this sweep, colocated heterogeneity improves TFLOPS/GPU by up to 49.3%, while non-colocated heterogeneity improves aggregate token throughput by up to 13.0% and TFLOPS/GPU by up to 9.6%. We validate loss convergence parity against homogeneous baselines and release the system as an open-source Megatron-LM extension.",random,0.12649758,0
2307.01238,Learning Difference Equations with Structured Grammatical Evolution for Postprandial Glycaemia Prediction,"People with diabetes must carefully monitor their blood glucose levels, especially after eating. Blood glucose regulation requires a proper combination of food intake and insulin boluses. Glucose prediction is vital to avoid dangerous post-meal complications in treating individuals with diabetes. Although traditional methods, such as artificial neural networks, have shown high accuracy rates, sometimes they are not suitable for developing personalised treatments by physicians due to their lack of interpretability. In this study, we propose a novel glucose prediction method emphasising interpretability: Interpretable Sparse Identification by Grammatical Evolution. Combined with a previous clustering stage, our approach provides finite difference equations to predict postprandial glucose levels up to two hours after meals. We divide the dataset into four-hour segments and perform clustering based on blood glucose values for the twohour window before the meal. Prediction models are trained for each cluster for the two-hour windows after meals, allowing predictions in 15-minute steps, yielding up to eight predictions at different time horizons. Prediction safety was evaluated based on Parkes Error Grid regions. Our technique produces safe predictions through explainable expressions, avoiding zones D (0.2% average) and E (0%) and reducing predictions on zone C (6.2%). In addition, our proposal has slightly better accuracy than other techniques, including sparse identification of non-linear dynamics and artificial neural networks. The results demonstrate that our proposal provides interpretable solutions without sacrificing prediction accuracy, offering a promising approach to glucose prediction in diabetes management that balances accuracy, interpretability, and computational efficiency.",random,0.018335495,0
2507.21193,Interpretable Anomaly-Based DDoS Detection in AI-RAN with XAI and LLMs,"Next generation Radio Access Networks (RANs) introduce programmability, intelligence, and near real-time control through intelligent controllers, enabling enhanced security within the RAN and across broader 5G/6G infrastructures. This paper presents a comprehensive survey highlighting opportunities, challenges, and research gaps for Large Language Models (LLMs)-assisted explainable (XAI) intrusion detection (IDS) for secure future RAN environments. Motivated by this, we propose an LLM interpretable anomaly-based detection system for distributed denial-of-service (DDoS) attacks using multivariate time series key performance measures (KPMs), extracted from E2 nodes, within the Near Real-Time RAN Intelligent Controller (Near-RT RIC). An LSTM-based model is trained to identify malicious User Equipment (UE) behavior based on these KPMs. To enhance transparency, we apply post-hoc local explainability methods such as LIME and SHAP to interpret individual predictions. Furthermore, LLMs are employed to convert technical explanations into natural-language insights accessible to non-expert users. Experimental results on real 5G network KPMs demonstrate that our framework achieves high detection accuracy (F1-score > 0.96) while delivering actionable and interpretable outputs.",random,0.3067565,0
2410.06509,PFAttack: Stealthy Attack Bypassing Group Fairness in Federated Learning,"Federated learning (FL), integrating group fairness mechanisms, allows multiple clients to collaboratively train a global model that makes unbiased decisions for different populations grouped by sensitive attributes (e.g., gender and race). Due to its distributed nature, previous studies have demonstrated that FL systems are vulnerable to model poisoning attacks. However, these studies primarily focus on perturbing accuracy, leaving a critical question unexplored: Can an attacker bypass the group fairness mechanisms in FL and manipulate the global model to be biased? The motivations for such an attack vary; an attacker might seek higher accuracy, yet fairness considerations typically limit the accuracy of the global model or aim to cause ethical disruption. To address this question, we design a novel form of attack in FL, termed Profit-driven Fairness Attack (PFAttack), which aims not to degrade global model accuracy but to bypass fairness mechanisms. Our fundamental insight is that group fairness seeks to weaken the dependence of outputs on input attributes related to sensitive information. In the proposed PFAttack, an attacker can recover this dependence through local fine-tuning across various sensitive groups, thereby creating a biased yet accuracy-preserving malicious model and injecting it into FL through model replacement. Compared to attacks targeting accuracy, PFAttack is more stealthy. The malicious model in PFAttack exhibits subtle parameter variations relative to the original global model, making it robust against detection and filtering by Byzantine-resilient aggregations. Extensive experiments on benchmark datasets are conducted for four fair FL frameworks and three Byzantine-resilient aggregations against model poisoning, demonstrating the effectiveness and stealth of PFAttack in bypassing group fairness mechanisms in FL.",random,0.1107385,0
2101.11131,CLiMP: A Benchmark for Chinese Language Model Evaluation,"Linguistically informed analyses of language models (LMs) contribute to the understanding and improvement of these models. Here, we introduce the corpus of Chinese linguistic minimal pairs (CLiMP), which can be used to investigate what knowledge Chinese LMs acquire. CLiMP consists of sets of 1,000 minimal pairs (MPs) for 16 syntactic contrasts in Mandarin, covering 9 major Mandarin linguistic phenomena. The MPs are semi-automatically generated, and human agreement with the labels in CLiMP is 95.8%. We evaluated 11 different LMs on CLiMP, covering n-grams, LSTMs, and Chinese BERT. We find that classifier-noun agreement and verb complement selection are the phenomena that models generally perform best at. However, models struggle the most with the ba construction, binding, and filler-gap dependencies. Overall, Chinese BERT achieves an 81.8% average accuracy, while the performances of LSTMs and 5-grams are only moderately above chance level.",random,0.1433984,0
2601.21157,Bridging the Arithmetic Gap: The Cognitive Complexity Benchmark and Financial-PoT for Robust Financial Reasoning,"While Large Language Models excel at semantic tasks, they face a critical bottleneck in financial quantitative reasoning, frequently suffering from ""Arithmetic Hallucinations"" and a systemic failure mode we term ""Cognitive Collapse"". To strictly quantify this phenomenon, we introduce the Cognitive Complexity Benchmark (CCB), a robust evaluation framework grounded in a dataset constructed from 95 real-world Chinese A-share annual reports. Unlike traditional datasets, the CCB stratifies financial queries into a three-dimensional taxonomy, Data Source, Mapping Difficulty, and Result Unit, enabling the precise diagnosis of reasoning degradation in high-cognitive-load scenarios. To address these failures, we propose the Iterative Dual-Phase Financial-PoT framework. This neuro-symbolic architecture enforces a strict architectural decoupling: it first isolates semantic variable extraction and logic formulation, then offloads computation to an iterative, self-correcting Python sandbox to ensure deterministic execution. Evaluation on the CCB demonstrates that while standard Chain-of-Thought falters on complex tasks, our approach offers superior robustness, elevating the Qwen3-235B model's average accuracy from 59.7\% to 67.3\% and achieving gains of up to 10-fold in high-complexity reasoning tasks. These findings suggest that architectural decoupling is a critical enabling factor for improving reliability in financial reasoning tasks, providing a transferable architectural insight for precision-critical domains that require tight alignment between semantic understanding and quantitative computation.",random,0.028101306,0
2404.03514,Embedding-Informed Adaptive Retrieval-Augmented Generation of Large Language Models,"Retrieval-augmented large language models (LLMs) have been remarkably competent in various NLP tasks. However, it was observed by previous works that retrieval is not always helpful, especially when the LLM is already knowledgeable on the query to answer. Motivated by this, Adaptive Retrieval-Augmented Generation (ARAG) studies retrieving only when the knowledge asked by the query is absent in the LLM. Previous works of ARAG either require accessing the pre-training corpus or prompting with additional model inferences. Aiming to avoid such drawbacks, we propose to determine whether the model is knowledgeable on a query via inspecting the (contextualized) pre-trained token embeddings of LLMs. We hypothesize that such embeddings capture rich information on the model's intrinsic knowledge base, which enables an efficient way of judging the necessity to retrieve from an external corpus. Extensive experiments demonstrate our ARAG approach's superior performance across various benchmarks.",random,0.06602408,0
2505.06620,"Integrating Explainable AI in Medical Devices: Technical, Clinical and Regulatory Insights and Recommendations","There is a growing demand for the use of Artificial Intelligence (AI) and Machine Learning (ML) in healthcare, particularly as clinical decision support systems to assist medical professionals. However, the complexity of many of these models, often referred to as black box models, raises concerns about their safe integration into clinical settings as it is difficult to understand how they arrived at their predictions. This paper discusses insights and recommendations derived from an expert working group convened by the UK Medicine and Healthcare products Regulatory Agency (MHRA). The group consisted of healthcare professionals, regulators, and data scientists, with a primary focus on evaluating the outputs from different AI algorithms in clinical decision-making contexts. Additionally, the group evaluated findings from a pilot study investigating clinicians' behaviour and interaction with AI methods during clinical diagnosis. Incorporating AI methods is crucial for ensuring the safety and trustworthiness of medical AI devices in clinical settings. Adequate training for stakeholders is essential to address potential issues, and further insights and recommendations for safely adopting AI systems in healthcare settings are provided.",random,0.092342965,0
2002.06504,Differentiable Top-k Operator with Optimal Transport,"The top-k operation, i.e., finding the k largest or smallest elements from a collection of scores, is an important model component, which is widely used in information retrieval, machine learning, and data mining. However, if the top-k operation is implemented in an algorithmic way, e.g., using bubble algorithm, the resulting model cannot be trained in an end-to-end way using prevalent gradient descent algorithms. This is because these implementations typically involve swapping indices, whose gradient cannot be computed. Moreover, the corresponding mapping from the input scores to the indicator vector of whether this element belongs to the top-k set is essentially discontinuous. To address the issue, we propose a smoothed approximation, namely the SOFT (Scalable Optimal transport-based diFferenTiable) top-k operator. Specifically, our SOFT top-k operator approximates the output of the top-k operation as the solution of an Entropic Optimal Transport (EOT) problem. The gradient of the SOFT operator can then be efficiently approximated based on the optimality conditions of EOT problem. We apply the proposed operator to the k-nearest neighbors and beam search algorithms, and demonstrate improved performance.",random,0.0020520312,0
2410.02558,Improving Unsupervised Constituency Parsing via Maximizing Semantic Information,"Unsupervised constituency parsers organize phrases within a sentence into a tree-shaped syntactic constituent structure that reflects the organization of sentence semantics. However, the traditional objective of maximizing sentence log-likelihood (LL) does not explicitly account for the close relationship between the constituent structure and the semantics, resulting in a weak correlation between LL values and parsing accuracy. In this paper, we introduce a novel objective that trains parsers by maximizing SemInfo, the semantic information encoded in constituent structures. We introduce a bag-of-substrings model to represent the semantics and estimate the SemInfo value using the probability-weighted information metric. We apply the SemInfo maximization objective to training Probabilistic Context-Free Grammar (PCFG) parsers and develop a Tree Conditional Random Field (TreeCRF)-based model to facilitate the training. Experiments show that SemInfo correlates more strongly with parsing accuracy than LL, establishing SemInfo as a better unsupervised parsing objective. As a result, our algorithm significantly improves parsing accuracy by an average of 7.85 sentence-F1 scores across five PCFG variants and in four languages, achieving state-of-the-art level results in three of the four languages.",random,0.019519214,0
2002.10851,Small-Footprint Open-Vocabulary Keyword Spotting with Quantized LSTM Networks,"We explore a keyword-based spoken language understanding system, in which the intent of the user can directly be derived from the detection of a sequence of keywords in the query. In this paper, we focus on an open-vocabulary keyword spotting method, allowing the user to define their own keywords without having to retrain the whole model. We describe the different design choices leading to a fast and small-footprint system, able to run on tiny devices, for any arbitrary set of user-defined keywords, without training data specific to those keywords. The model, based on a quantized long short-term memory (LSTM) neural network, trained with connectionist temporal classification (CTC), weighs less than 500KB. Our approach takes advantage of some properties of the predictions of CTC-trained networks to calibrate the confidence scores and implement a fast detection algorithm. The proposed system outperforms a standard keyword-filler model approach.",random,0.0027278783,0
2201.06250,Improving Clinical Diagnosis Performance with Automated X-ray Scan Quality Enhancement Algorithms,"In clinical diagnosis, diagnostic images that are obtained from the scanning devices serve as preliminary evidence for further investigation in the process of delivering quality healthcare. However, often the medical image may contain fault artifacts, introduced due to noise, blur and faulty equipment. The reason for this may be the low-quality or older scanning devices, the test environment or technicians lack of training etc; however, the net result is that the process of fast and reliable diagnosis is hampered. Resolving these issues automatically can have a significant positive impact in a hospital clinical workflow, where often, there is no other way but to work with faulty/older equipment or inadequately qualified radiology technicians. In this paper, automated image quality improvement approaches for adapted and benchmarked for the task of medical image super-resolution. During experimental evaluation on standard open datasets, the observations showed that certain algorithms perform better and show significant improvement in the diagnostic quality of medical scans, thereby enabling better visualization for human diagnostic purposes.",random,0.0014378646,0
2209.08633,CNN based Intelligent Streetlight Management Using Smart CCTV Camera and Semantic Segmentation,"One of the most neglected sources of energy loss is streetlights which generate too much light in areas where it is not required. Energy waste has enormous economic and environmental effects. In addition, due to the conventional manual nature of the operation, streetlights are frequently seen being turned ON during the day and OFF in the evening, which is regrettable even in the twenty-first century. These issues require automated streetlight control in order to be resolved. This study aims to develop a novel streetlight controlling method by combining a smart transport monitoring system powered by computer vision technology with a closed circuit television (CCTV) camera that allows the light-emitting diode (LED) streetlight to automatically light up with the appropriate brightness by detecting the presence of pedestrians or vehicles and dimming the streetlight in their absence using semantic image segmentation from the CCTV video streaming. Consequently, our model distinguishes daylight and nighttime, which made it feasible to automate the process of turning the streetlight 'ON' and 'OFF' to save energy consumption costs. According to the aforementioned approach, geolocation sensor data could be utilized to make more informed streetlight management decisions. To complete the tasks, we consider training the U-net model with ResNet-34 as its backbone. The validity of the models is guaranteed with the use of assessment matrices. The suggested concept is straightforward, economical, energy-efficient, long-lasting, and more resilient than conventional alternatives.",random,0.023938656,0
2111.01363,Knowledge Cross-Distillation for Membership Privacy,"A membership inference attack (MIA) poses privacy risks for the training data of a machine learning model. With an MIA, an attacker guesses if the target data are a member of the training dataset. The state-of-the-art defense against MIAs, distillation for membership privacy (DMP), requires not only private data for protection but a large amount of unlabeled public data. However, in certain privacy-sensitive domains, such as medicine and finance, the availability of public data is not guaranteed. Moreover, a trivial method for generating public data by using generative adversarial networks significantly decreases the model accuracy, as reported by the authors of DMP. To overcome this problem, we propose a novel defense against MIAs that uses knowledge distillation without requiring public data. Our experiments show that the privacy protection and accuracy of our defense are comparable to those of DMP for the benchmark tabular datasets used in MIA research, Purchase100 and Texas100, and our defense has a much better privacy-utility trade-off than those of the existing defenses that also do not use public data for the image dataset CIFAR10.",random,0.0012092084,0
2103.01362,Operator inference of non-Markovian terms for learning reduced models from partially observed state trajectories,"This work introduces a non-intrusive model reduction approach for learning reduced models from partially observed state trajectories of high-dimensional dynamical systems. The proposed approach compensates for the loss of information due to the partially observed states by constructing non-Markovian reduced models that make future-state predictions based on a history of reduced states, in contrast to traditional Markovian reduced models that rely on the current reduced state alone to predict the next state. The core contributions of this work are a data sampling scheme to sample partially observed states from high-dimensional dynamical systems and a formulation of a regression problem to fit the non-Markovian reduced terms to the sampled states. Under certain conditions, the proposed approach recovers from data the very same non-Markovian terms that one obtains with intrusive methods that require the governing equations and discrete operators of the high-dimensional dynamical system. Numerical results demonstrate that the proposed approach leads to non-Markovian reduced models that are predictive far beyond the training regime. Additionally, in the numerical experiments, the proposed approach learns non-Markovian reduced models from trajectories with only 20% observed state components that are about as accurate as traditional Markovian reduced models fitted to trajectories with 99% observed components.",random,0.0057129283,0
2604.23432,Sphere-Depth: A Benchmark for Depth Estimation Methods with Varying Spherical Camera Orientations,"Reliable depth estimation from spherical images is crucial for 360° vision in robotic navigation and immersive scene understanding. However, the onboard spherical camera can experience unintentional pose variations in real-world robotic platforms that, along with the geometric distortions inherent in equirectangular projections, significantly impact the effectiveness of depth estimation. To study this issue, a novel public benchmark, called Sphere-Depth, is introduced to systematically evaluate the robustness of monocular depth estimation models from equirectangular images in a reproducible way. Camera pose perturbations are simulated and used to assess the performance of a popular perspective-based model, Depth Anything, and of spherical-aware models such as Depth Anywhere, ACDNet, Bifuse++, and SliceNet. Furthermore, to ensure meaningful evaluation across models, a depth calibration-based error protocol is proposed to convert predicted relative depth values into metric depth values using supervised learned scaling factors for each model. Experiments show that even models explicitly designed to process spherical images exhibit substantial performance degradation when variations in the camera pose are observed with respect to the canonical pose. The full benchmark, evaluation protocol, and dataset splits are made publicly available at: https://github.com/sgazzeh/Sphere_depth",random,0.001456675,0
2505.19644,STOPA: A Database of Systematic VariaTion Of DeePfake Audio for Open-Set Source Tracing and Attribution,"A key research area in deepfake speech detection is source tracing - determining the origin of synthesised utterances. The approaches may involve identifying the acoustic model (AM), vocoder model (VM), or other generation-specific parameters. However, progress is limited by the lack of a dedicated, systematically curated dataset. To address this, we introduce STOPA, a systematically varied and metadata-rich dataset for deepfake speech source tracing, covering 8 AMs, 6 VMs, and diverse parameter settings across 700k samples from 13 distinct synthesisers. Unlike existing datasets, which often feature limited variation or sparse metadata, STOPA provides a systematically controlled framework covering a broader range of generative factors, such as the choice of the vocoder model, acoustic model, or pretrained weights, ensuring higher attribution reliability. This control improves attribution accuracy, aiding forensic analysis, deepfake detection, and generative model transparency.",random,0.007217607,0
