id,title,abstract,stratum,tfidf_proba,tfidf_pred
2303.05072,Identification of Systematic Errors of Image Classifiers on Rare Subgroups,"Despite excellent average-case performance of many image classifiers, their performance can substantially deteriorate on semantically coherent subgroups of the data that were under-represented in the training data. These systematic errors can impact both fairness for demographic minority groups as well as robustness and safety under domain shift. A major challenge is to identify such subgroups with subpar performance when the subgroups are not annotated and their occurrence is very rare. We leverage recent advances in text-to-image models and search in the space of textual descriptions of subgroups (""prompts"") for subgroups where the target model has low performance on the prompt-conditioned synthesized data. To tackle the exponentially growing number of subgroups, we employ combinatorial testing. We denote this procedure as PromptAttack as it can be interpreted as an adversarial attack in a prompt space. We study subgroup coverage and identifiability with PromptAttack in a controlled setting and find that it identifies systematic errors with high accuracy. Thereupon, we apply PromptAttack to ImageNet classifiers and identify novel systematic errors on rare subgroups.",random,0.09642862,0
2111.14826,Nonuniform-to-Uniform Quantization: Towards Accurate Quantization via Generalized Straight-Through Estimation,"The nonuniform quantization strategy for compressing neural networks usually achieves better performance than its counterpart, i.e., uniform strategy, due to its superior representational capacity. However, many nonuniform quantization methods overlook the complicated projection process in implementing the nonuniformly quantized weights/activations, which incurs non-negligible time and space overhead in hardware deployment. In this study, we propose Nonuniform-to-Uniform Quantization (N2UQ), a method that can maintain the strong representation ability of nonuniform methods while being hardware-friendly and efficient as the uniform quantization for model inference. We achieve this through learning the flexible in-equidistant input thresholds to better fit the underlying distribution while quantizing these real-valued inputs into equidistant output levels. To train the quantized network with learnable input thresholds, we introduce a generalized straight-through estimator (G-STE) for intractable backward derivative calculation w.r.t. threshold parameters. Additionally, we consider entropy preserving regularization to further reduce information loss in weight quantization. Even under this adverse constraint of imposing uniformly quantized weights and activations, our N2UQ outperforms state-of-the-art nonuniform quantization methods by 0.5~1.7 on ImageNet, demonstrating the contribution of N2UQ design. Code and models are available at: https://github.com/liuzechun/Nonuniform-to-Uniform-Quantization.",random,0.0028517458,0
2603.13300,Safety-Guided Flow (SGF): A Unified Framework for Negative Guidance in Safe Generation,"Safety mechanisms for diffusion and flow models have recently been developed along two distinct paths. In robot planning, control barrier functions are employed to guide generative trajectories away from obstacles at every denoising step by explicitly imposing geometric constraints. In parallel, recent data-driven, negative guidance approaches have been shown to suppress harmful content and promote diversity in generated samples. However, they rely on heuristics without clearly stating when safety guidance is actually necessary. In this paper, we first introduce a unified probabilistic framework using a Maximum Mean Discrepancy (MMD) potential for image generation tasks that recasts both Shielded Diffusion and Safe Denoiser as instances of our energy-based negative guidance against unsafe data samples. Furthermore, we leverage control-barrier functions analysis to justify the existence of a critical time window in which negative guidance must be strong; outside of this window, the guidance should decay to zero to ensure safe and high-quality generation. We evaluate our unified framework on several realistic safe generation scenarios, confirming that negative guidance should be applied in the early stages of the denoising process for successful safe generation.",random,0.97552603,1
2009.05671,Inverse mapping of face GANs,"Generative adversarial networks (GANs) synthesize realistic images from a random latent vector. While many studies have explored various training configurations and architectures for GANs, the problem of inverting a generative model to extract latent vectors of given input images has been inadequately investigated. Although there is exactly one generated image per given random vector, the mapping from an image to its recovered latent vector can have more than one solution. We train a ResNet architecture to recover a latent vector for a given face that can be used to generate a face nearly identical to the target. We use a perceptual loss to embed face details in the recovered latent vector while maintaining visual quality using a pixel loss. The vast majority of studies on latent vector recovery perform well only on generated images, we argue that our method can be used to determine a mapping between real human faces and latent-space vectors that contain most of the important face style details. In addition, our proposed method projects generated faces to their latent-space with high fidelity and speed. At last, we demonstrate the performance of our approach on both real and generated faces.",random,0.0020757504,0
2012.01467,Generating private data with user customization,"Personal devices such as mobile phones can produce and store large amounts of data that can enhance machine learning models; however, this data may contain private information specific to the data owner that prevents the release of the data. We want to reduce the correlation between user-specific private information and the data while retaining the useful information. Rather than training a large model to achieve privatization from end to end, we first decouple the creation of a latent representation, and then privatize the data that allows user-specific privatization to occur in a setting with limited computation and minimal disturbance on the utility of the data. We leverage a Variational Autoencoder (VAE) to create a compact latent representation of the data that remains fixed for all devices and all possible private labels. We then train a small generative filter to perturb the latent representation based on user specified preferences regarding the private and utility information. The small filter is trained via a GAN-type robust optimization that can take place on a distributed device such as a phone or tablet. Under special conditions of our linear filter, we disclose the connections between our generative approach and renyi differential privacy. We conduct experiments on multiple datasets including MNIST, UCI-Adult, and CelebA, and give a thorough evaluation including visualizing the geometry of the latent embeddings and estimating the empirical mutual information to show the effectiveness of our approach.",random,0.006027224,0
2502.14381,dtaianomaly: A Python library for time series anomaly detection,"dtaianomaly is an open-source Python library for time series anomaly detection, designed to bridge the gap between academic research and real-world applications. Our goal is to (1) accelerate the development of novel state-of-the-art anomaly detection techniques through simple extensibility; (2) offer functionality for large-scale experimental validation; and thereby (3) bring cutting-edge research to business and industry through a standardized API, similar to scikit-learn to lower the entry barrier for both new and experienced users. Besides these key features, dtaianomaly offers (1) a broad range of built-in anomaly detectors, (2) support for time series preprocessing, (3) tools for visual analysis, (4) confidence prediction of anomaly scores, (5) runtime and memory profiling, (6) comprehensive documentation, and (7) cross-platform unit testing. The source code of dtaianomaly, documentation, code examples and installation guides are publicly available at https://github.com/ML-KULeuven/dtaianomaly.",random,0.0014579754,0
2111.04314,Graph Robustness Benchmark: Benchmarking the Adversarial Robustness of Graph Machine Learning,"Adversarial attacks on graphs have posed a major threat to the robustness of graph machine learning (GML) models. Naturally, there is an ever-escalating arms race between attackers and defenders. However, the strategies behind both sides are often not fairly compared under the same and realistic conditions. To bridge this gap, we present the Graph Robustness Benchmark (GRB) with the goal of providing a scalable, unified, modular, and reproducible evaluation for the adversarial robustness of GML models. GRB standardizes the process of attacks and defenses by 1) developing scalable and diverse datasets, 2) modularizing the attack and defense implementations, and 3) unifying the evaluation protocol in refined scenarios. By leveraging the GRB pipeline, the end-users can focus on the development of robust GML models with automated data processing and experimental evaluations. To support open and reproducible research on graph adversarial learning, GRB also hosts public leaderboards across different scenarios. As a starting point, we conduct extensive experiments to benchmark baseline techniques. GRB is open-source and welcomes contributions from the community. Datasets, codes, leaderboards are available at https://cogdl.ai/grb/home.",random,0.12864405,0
1910.14443,Multi-scale Octave Convolutions for Robust Speech Recognition,"We propose a multi-scale octave convolution layer to learn robust speech representations efficiently. Octave convolutions were introduced by Chen et al [1] in the computer vision field to reduce the spatial redundancy of the feature maps by decomposing the output of a convolutional layer into feature maps at two different spatial resolutions, one octave apart. This approach improved the efficiency as well as the accuracy of the CNN models. The accuracy gain was attributed to the enlargement of the receptive field in the original input space. We argue that octave convolutions likewise improve the robustness of learned representations due to the use of average pooling in the lower resolution group, acting as a low-pass filter. We test this hypothesis by evaluating on two noisy speech corpora - Aurora-4 and AMI. We extend the octave convolution concept to multiple resolution groups and multiple octaves. To evaluate the robustness of the inferred representations, we report the similarity between clean and noisy encodings using an affine projection loss as a proxy robustness measure. The results show that proposed method reduces the WER by up to 6.6% relative for Aurora-4 and 3.6% for AMI, while improving the computational efficiency of the CNN acoustic models.",random,0.0074488134,0
2511.09147,PressTrack-HMR: Pressure-Based Top-Down Multi-Person Global Human Mesh Recovery,"Multi-person global human mesh recovery (HMR) is crucial for understanding crowd dynamics and interactions. Traditional vision-based HMR methods sometimes face limitations in real-world scenarios due to mutual occlusions, insufficient lighting, and privacy concerns. Human-floor tactile interactions offer an occlusion-free and privacy-friendly alternative for capturing human motion. Existing research indicates that pressure signals acquired from tactile mats can effectively estimate human pose in single-person scenarios. However, when multiple individuals walk randomly on the mat simultaneously, how to distinguish intermingled pressure signals generated by different persons and subsequently acquire individual temporal pressure data remains a pending challenge for extending pressure-based HMR to the multi-person situation. In this paper, we present \textbf{PressTrack-HMR}, a top-down pipeline that recovers multi-person global human meshes solely from pressure signals. This pipeline leverages a tracking-by-detection strategy to first identify and segment each individual's pressure signal from the raw pressure data, and subsequently performs HMR for each extracted individual signal. Furthermore, we build a multi-person interaction pressure dataset \textbf{MIP}, which facilitates further research into pressure-based human motion analysis in multi-person scenarios. Experimental results demonstrate that our method excels in multi-person HMR using pressure data, with 89.2 $mm$ MPJPE and 112.6 $mm$ WA-MPJPE$_{100}$, and these showcase the potential of tactile mats for ubiquitous, privacy-preserving multi-person action recognition. Our dataset & code are available at https://github.com/Jiayue-Yuan/PressTrack-HMR.",random,0.0050799297,0
2407.14562,Thought-Like-Pro: Enhancing Reasoning of Large Language Models through Self-Driven Prolog-based Chain-of-Thought,"Large language models (LLMs) have shown exceptional performance as general-purpose assistants, excelling across a variety of reasoning tasks. This achievement represents a significant step toward achieving artificial general intelligence (AGI). Despite these advancements, the effectiveness of LLMs often hinges on the specific prompting strategies employed, and there remains a lack of a robust framework to facilitate learning and generalization across diverse reasoning tasks. To address these challenges, we introduce a novel learning framework, THOUGHT-LIKE-PRO In this framework, we utilize imitation learning to imitate the Chain-of-Thought (CoT) process which is verified and translated from reasoning trajectories generated by a symbolic Prolog logic engine. This framework proceeds in a self-driven manner, that enables LLMs to formulate rules and statements from given instructions and leverage the symbolic Prolog engine to derive results. Subsequently, LLMs convert Prolog-derived successive reasoning trajectories into natural language CoT for imitation learning. Our empirical findings indicate that our proposed approach substantially enhances the reasoning abilities of LLMs and demonstrates robust generalization across out-of-distribution reasoning tasks.",random,0.035040334,0
2204.00061,Data-augmented cross-lingual synthesis in a teacher-student framework,"Cross-lingual synthesis can be defined as the task of letting a speaker generate fluent synthetic speech in another language. This is a challenging task, and resulting speech can suffer from reduced naturalness, accented speech, and/or loss of essential voice characteristics. Previous research shows that many models appear to have insufficient generalization capabilities to perform well on every of these cross-lingual aspects. To overcome these generalization problems, we propose to apply the teacher-student paradigm to cross-lingual synthesis. While a teacher model is commonly used to produce teacher forced data, we propose to also use it to produce augmented data of unseen speaker-language pairs, where the aim is to retain essential speaker characteristics. Both sets of data are then used for student model training, which is trained to retain the naturalness and prosodic variation present in the teacher forced data, while learning the speaker identity from the augmented data. Some modifications to the student model are proposed to make the separation of teacher forced and augmented data more straightforward. Results show that the proposed approach improves the retention of speaker characteristics in the speech, while managing to retain high levels of naturalness and prosodic variation.",random,0.009200902,0
2512.16962,MemoryGraft: Persistent Compromise of LLM Agents via Poisoned Experience Retrieval,"Large Language Model (LLM) agents increasingly rely on long-term memory and Retrieval-Augmented Generation (RAG) to persist experiences and refine future performance. While this experience learning capability enhances agentic autonomy, it introduces a critical, unexplored attack surface, i.e., the trust boundary between an agent's reasoning core and its own past. In this paper, we introduce MemoryGraft. It is a novel indirect injection attack that compromises agent behavior not through immediate jailbreaks, but by implanting malicious successful experiences into the agent's long-term memory. Unlike traditional prompt injections that are transient, or standard RAG poisoning that targets factual knowledge, MemoryGraft exploits the agent's semantic imitation heuristic which is the tendency to replicate patterns from retrieved successful tasks. We demonstrate that an attacker who can supply benign ingestion-level artifacts that the agent reads during execution can induce it to construct a poisoned RAG store where a small set of malicious procedure templates is persisted alongside benign experiences. When the agent later encounters semantically similar tasks, union retrieval over lexical and embedding similarity reliably surfaces these grafted memories, and the agent adopts the embedded unsafe patterns, leading to persistent behavioral drift across sessions. We validate MemoryGraft on MetaGPT's DataInterpreter agent with GPT-4o and find that a small number of poisoned records can account for a large fraction of retrieved experiences on benign workloads, turning experience-based self-improvement into a vector for stealthy and durable compromise. To facilitate reproducibility and future research, our code and evaluation data are available at https://github.com/Jacobhhy/Agent-Memory-Poisoning.",random,0.98713183,1
2512.04958,Realizable Abstractions: Near-Optimal Hierarchical Reinforcement Learning,"The main focus of Hierarchical Reinforcement Learning (HRL) is studying how large Markov Decision Processes (MDPs) can be more efficiently solved when addressed in a modular way, by combining partial solutions computed for smaller subtasks. Despite their very intuitive role for learning, most notions of MDP abstractions proposed in the HRL literature have limited expressive power or do not possess formal efficiency guarantees. This work addresses these fundamental issues by defining Realizable Abstractions, a new relation between generic low-level MDPs and their associated high-level decision processes. The notion we propose avoids non-Markovianity issues and has desirable near-optimality guarantees. Indeed, we show that any abstract policy for Realizable Abstractions can be translated into near-optimal policies for the low-level MDP, through a suitable composition of options. As demonstrated in the paper, these options can be expressed as solutions of specific constrained MDPs. Based on these findings, we propose RARL, a new HRL algorithm that returns compositional and near-optimal low-level policies, taking advantage of the Realizable Abstraction given in the input. We show that RARL is Probably Approximately Correct, it converges in a polynomial number of samples, and it is robust to inaccuracies in the abstraction.",random,0.0039798473,0
2405.06705,LLMs can Find Mathematical Reasoning Mistakes by Pedagogical Chain-of-Thought,"Self-correction is emerging as a promising approach to mitigate the issue of hallucination in Large Language Models (LLMs). To facilitate effective self-correction, recent research has proposed mistake detection as its initial step. However, current literature suggests that LLMs often struggle with reliably identifying reasoning mistakes when using simplistic prompting strategies. To address this challenge, we introduce a unique prompting strategy, termed the Pedagogical Chain-of-Thought (PedCoT), which is specifically designed to guide the identification of reasoning mistakes, particularly mathematical reasoning mistakes. PedCoT consists of pedagogical principles for prompts (PPP) design, two-stage interaction process (TIP) and grounded PedCoT prompts, all inspired by the educational theory of the Bloom Cognitive Model (BCM). We evaluate our approach on two public datasets featuring math problems of varying difficulty levels. The experiments demonstrate that our zero-shot prompting strategy significantly outperforms strong baselines. The proposed method can achieve the goal of reliable mathematical mistake identification and provide a foundation for automatic math answer grading. The results underscore the significance of educational theory, serving as domain knowledge, in guiding prompting strategy design for addressing challenging tasks with LLMs effectively.",random,0.012402373,0
1912.01580,A Comparative Study of Pretrained Language Models on Thai Social Text Categorization,"The ever-growing volume of data of user-generated content on social media provides a nearly unlimited corpus of unlabeled data even in languages where resources are scarce. In this paper, we demonstrate that state-of-the-art results on two Thai social text categorization tasks can be realized by pretraining a language model on a large noisy Thai social media corpus of over 1.26 billion tokens and later fine-tuned on the downstream classification tasks. Due to the linguistically noisy and domain-specific nature of the content, our unique data preprocessing steps designed for Thai social media were utilized to ease the training comprehension of the model. We compared four modern language models: ULMFiT, ELMo with biLSTM, OpenAI GPT, and BERT. We systematically compared the models across different dimensions including speed of pretraining and fine-tuning, perplexity, downstream classification benchmarks, and performance in limited pretraining data.",random,0.0660888,0
2008.07873,S^3-Rec: Self-Supervised Learning for Sequential Recommendation with Mutual Information Maximization,"Recently, significant progress has been made in sequential recommendation with deep learning. Existing neural sequential recommendation models usually rely on the item prediction loss to learn model parameters or data representations. However, the model trained with this loss is prone to suffer from data sparsity problem. Since it overemphasizes the final performance, the association or fusion between context data and sequence data has not been well captured and utilized for sequential recommendation. To tackle this problem, we propose the model S^3-Rec, which stands for Self-Supervised learning for Sequential Recommendation, based on the self-attentive neural architecture. The main idea of our approach is to utilize the intrinsic data correlation to derive self-supervision signals and enhance the data representations via pre-training methods for improving sequential recommendation. For our task, we devise four auxiliary self-supervised objectives to learn the correlations among attribute, item, subsequence, and sequence by utilizing the mutual information maximization (MIM) principle. MIM provides a unified way to characterize the correlation between different types of data, which is particularly suitable in our scenario. Extensive experiments conducted on six real-world datasets demonstrate the superiority of our proposed method over existing state-of-the-art methods, especially when only limited training data is available. Besides, we extend our self-supervised learning method to other recommendation models, which also improve their performance.",random,0.00042442317,0
2302.14027,Diversity matters: Robustness of bias measurements in Wikidata,"With the widespread use of knowledge graphs (KG) in various automated AI systems and applications, it is very important to ensure that information retrieval algorithms leveraging them are free from societal biases. Previous works have depicted biases that persist in KGs, as well as employed several metrics for measuring the biases. However, such studies lack the systematic exploration of the sensitivity of the bias measurements, through varying sources of data, or the embedding algorithms used. To address this research gap, in this work, we present a holistic analysis of bias measurement on the knowledge graph. First, we attempt to reveal data biases that surface in Wikidata for thirteen different demographics selected from seven continents. Next, we attempt to unfold the variance in the detection of biases by two different knowledge graph embedding algorithms - TransE and ComplEx. We conduct our extensive experiments on a large number of occupations sampled from the thirteen demographics with respect to the sensitive attribute, i.e., gender. Our results show that the inherent data bias that persists in KG can be altered by specific algorithm bias as incorporated by KG embedding learning algorithms. Further, we show that the choice of the state-of-the-art KG embedding algorithm has a strong impact on the ranking of biased occupations irrespective of gender. We observe that the similarity of the biased occupations across demographics is minimal which reflects the socio-cultural differences around the globe. We believe that this full-scale audit of the bias measurement pipeline will raise awareness among the community while deriving insights related to design choices of data and algorithms both and refrain from the popular dogma of ``one-size-fits-all''.",random,0.002142966,0
