id,title,abstract,stratum,tfidf_proba,tfidf_pred
1903.08850,Stochastic Optimization of Sorting Networks via Continuous Relaxations,"Sorting input objects is an important step in many machine learning pipelines. However, the sorting operator is non-differentiable with respect to its inputs, which prohibits end-to-end gradient-based optimization. In this work, we propose NeuralSort, a general-purpose continuous relaxation of the output of the sorting operator from permutation matrices to the set of unimodal row-stochastic matrices, where every row sums to one and has a distinct arg max. This relaxation permits straight-through optimization of any computational graph involve a sorting operation. Further, we use this relaxation to enable gradient-based stochastic optimization over the combinatorially large space of permutations by deriving a reparameterized gradient estimator for the Plackett-Luce family of distributions over permutations. We demonstrate the usefulness of our framework on three tasks that require learning semantic orderings of high-dimensional objects, including a fully differentiable, parameterized extension of the k-nearest neighbors algorithm.",random,0.00224315,0
2312.07824,A Deep Learning-Based System for Automatic Case Summarization,"This paper presents a deep learning-based system for efficient automatic case summarization. Leveraging state-of-the-art natural language processing techniques, the system offers both supervised and unsupervised methods to generate concise and relevant summaries of lengthy legal case documents. The user-friendly interface allows users to browse the system's database of legal case documents, select their desired case, and choose their preferred summarization method. The system generates comprehensive summaries for each subsection of the legal text as well as an overall summary. This demo streamlines legal case document analysis, potentially benefiting legal professionals by reducing workload and increasing efficiency. Future work will focus on refining summarization techniques and exploring the application of our methods to other types of legal texts.",random,0.00279922,0
2310.17645,PubDef: Defending Against Transfer Attacks From Public Models,"Adversarial attacks have been a looming and unaddressed threat in the industry. However, through a decade-long history of the robustness evaluation literature, we have learned that mounting a strong or optimal attack is challenging. It requires both machine learning and domain expertise. In other words, the white-box threat model, religiously assumed by a large majority of the past literature, is unrealistic. In this paper, we propose a new practical threat model where the adversary relies on transfer attacks through publicly available surrogate models. We argue that this setting will become the most prevalent for security-sensitive applications in the future. We evaluate the transfer attacks in this setting and propose a specialized defense method based on a game-theoretic perspective. The defenses are evaluated under 24 public models and 11 attack algorithms across three datasets (CIFAR-10, CIFAR-100, and ImageNet). Under this threat model, our defense, PubDef, outperforms the state-of-the-art white-box adversarial training by a large margin with almost no loss in the normal accuracy. For instance, on ImageNet, our defense achieves 62% accuracy under the strongest transfer attack vs only 36% of the best adversarially trained model. Its accuracy when not under attack is only 2% lower than that of an undefended model (78% vs 80%). We release our code at https://github.com/wagner-group/pubdef.",random,0.048469845,0
2510.11834,Don't Walk the Line: Boundary Guidance for Filtered Generation,"Generative models are increasingly paired with safety classifiers that filter harmful or undesirable outputs. A common strategy is to fine-tune the generator to reduce the probability of being filtered, but this can be suboptimal: it often pushes the model toward producing samples near the classifier's decision boundary, increasing both false positives and false negatives. We propose Boundary Guidance, a reinforcement learning fine-tuning method that explicitly steers generation away from the classifier's margin. On a benchmark of jailbreak, ambiguous, and longcontext prompts, Boundary Guidance improves both the safety and the utility of outputs, as judged by LLM-as-a-Judge evaluations. Comprehensive ablations across model scales and reward designs demonstrate the robustness of our approach.",random,0.983842,1
2603.00971,Random Features for Operator-Valued Kernels: Bridging Kernel Methods and Neural Operators,"In this work, we investigate the generalization properties of random feature methods. Our analysis extends prior results for Tikhonov regularization to a broad class of spectral regularization techniques and further generalizes the setting to operator-valued kernels. This unified framework enables a rigorous theoretical analysis of neural operators and neural networks through the lens of the Neural Tangent Kernel (NTK). In particular, it allows us to establish optimal learning rates and provides a good understanding of how many neurons are required to achieve a given accuracy. Furthermore, we establish minimax rates in the well-specified case and also in the misspecified case, where the target is not contained in the reproducing kernel Hilbert space. These results sharpen and complete earlier findings for specific kernel algorithms.",random,0.0122616,0
2010.04186,Machine Learning for Gas and Oil Exploration,"Drilling boreholes for gas and oil extraction is an expensive process and profitability strongly depends on characteristics of the subsurface. As profitability is a key success factor, companies in the industry utilise well logs to explore the subsurface beforehand. These well logs contain various characteristics of the rock around the borehole, which allow petrophysicists to determine the expected amount of contained hydrocarbon. However, these logs are often incomplete and, as a consequence, the subsequent analyses cannot exploit the full potential of the well logs. In this paper we demonstrate that Machine Learning can be applied to \emph{fill in the gaps} and estimate missing values. We investigate how the amount of training data influences the accuracy of prediction and how to best design regression models (Gradient Boosting and neural network) to obtain optimal results. We then explore the models' predictions both quantitatively, tracking the prediction error, and qualitatively, capturing the evolution of the measured and predicted values for a given property with depth. Combining the findings has enabled us to develop a predictive model that completes the well logs, increasing their quality and potential commercial value.",random,0.0066978894,0
2210.02656,Trust in Motion: Capturing Trust Ascendancy in Open-Source Projects using Hybrid AI,"Open-source is frequently described as a driver for unprecedented communication and collaboration, and the process works best when projects support teamwork. Yet, open-source cooperation processes in no way protect project contributors from considerations of trust, power, and influence. Indeed, achieving the level of trust necessary to contribute to a project and thus influence its direction is a constant process of change, and developers take many different routes over many communication channels to achieve it. We refer to this process of influence-seeking and trust-building as trust ascendancy. This paper describes a methodology for understanding the notion of trust ascendancy and introduces the capabilities that are needed to localize trust ascendancy operations happening over open-source projects. Much of the prior work in understanding trust in open-source software development has focused on a static view of the problem using different forms of quantity measures. However, trust ascendancy is not static, but rather adapts to changes in the open-source ecosystem in response to new input. This paper is the first attempt to articulate and study these signals from a dynamic view of the problem. In that respect, we identify related work that may help illuminate research challenges, implementation tradeoffs, and complementary solutions. Our preliminary results show the effectiveness of our method at capturing the trust ascendancy developed by individuals involved in a well-documented 2020 social engineering attack. Our future plans highlight research challenges and encourage cross-disciplinary collaboration to create more automated, accurate, and efficient ways to model and then track trust ascendancy in open-source projects.",random,0.13129668,0
2502.13044,Do we still need Human Annotators? Prompting Large Language Models for Aspect Sentiment Quad Prediction,"Aspect sentiment quad prediction (ASQP) facilitates a detailed understanding of opinions expressed in a text by identifying the opinion term, aspect term, aspect category and sentiment polarity for each opinion. However, annotating a full set of training examples to fine-tune models for ASQP is a resource-intensive process. In this study, we explore the capabilities of large language models (LLMs) for zero- and few-shot learning on the ASQP task across five diverse datasets. We report F1 scores almost up to par with those obtained with state-of-the-art fine-tuned models and exceeding previously reported zero- and few-shot performance. In the 20-shot setting on the Rest16 restaurant domain dataset, LLMs achieved an F1 score of 51.54, compared to 60.39 by the best-performing fine-tuned method MVP. Additionally, we report the performance of LLMs in target aspect sentiment detection (TASD), where the F1 scores were close to fine-tuned models, achieving 68.93 on Rest16 in the 30-shot setting, compared to 72.76 with MVP. While human annotators remain essential for achieving optimal performance, LLMs can reduce the need for extensive manual annotation in ASQP tasks.",random,0.026205342,0
2510.02818,Mitigating Spurious Correlation via Distributionally Robust Learning with Hierarchical Ambiguity Sets,"Conventional supervised learning methods are often vulnerable to spurious correlations, particularly under distribution shifts in test data. To address this issue, several approaches, most notably Group DRO, have been developed. While these methods are highly robust to subpopulation or group shifts, they remain vulnerable to intra-group distributional shifts, which frequently occur in minority groups with limited samples. We propose a hierarchical extension of Group DRO that addresses both inter-group and intra-group uncertainties, providing robustness to distribution shifts at multiple levels. We also introduce new benchmark settings that simulate realistic minority group distribution shifts-an important yet previously underexplored challenge in spurious correlation research. Our method demonstrates strong robustness under these conditions-where existing robust learning methods consistently fail-while also achieving superior performance on standard benchmarks. These results highlight the importance of broadening the ambiguity set to better capture both inter-group and intra-group distributional uncertainties.",random,0.011553369,0
2506.23619,Overparametrized models with posterior drift,"This paper investigates the impact of posterior drift on out-of-sample forecasting accuracy in overparametrized machine learning models. We document the loss in performance when the loadings of the data generating process change between the training and testing samples. This matters crucially in settings in which regime changes are likely to occur, for instance, in financial markets. Applied to equity premium forecasting, our results underline the sensitivity of a market timing strategy to sub-periods and to the bandwidth parameters that control the complexity of the model. For the average investor, we find that focusing on holding periods of 15 years can generate very heterogeneous returns, especially for small bandwidths. Large bandwidths yield much more consistent outcomes, but are far less appealing from a risk-adjusted return standpoint. All in all, our findings tend to recommend cautiousness when resorting to large linear models for stock market predictions.",random,0.0028477474,0
2010.10038,SOrT-ing VQA Models : Contrastive Gradient Learning for Improved Consistency,"Recent research in Visual Question Answering (VQA) has revealed state-of-the-art models to be inconsistent in their understanding of the world -- they answer seemingly difficult questions requiring reasoning correctly but get simpler associated sub-questions wrong. These sub-questions pertain to lower level visual concepts in the image that models ideally should understand to be able to answer the higher level question correctly. To address this, we first present a gradient-based interpretability approach to determine the questions most strongly correlated with the reasoning question on an image, and use this to evaluate VQA models on their ability to identify the relevant sub-questions needed to answer a reasoning question. Next, we propose a contrastive gradient learning based approach called Sub-question Oriented Tuning (SOrT) which encourages models to rank relevant sub-questions higher than irrelevant questions for an <image, reasoning-question> pair. We show that SOrT improves model consistency by upto 6.5% points over existing baselines, while also improving visual grounding.",random,0.005327116,0
2111.09159,Aggressive Q-Learning with Ensembles: Achieving Both High Sample Efficiency and High Asymptotic Performance,"Recent advances in model-free deep reinforcement learning (DRL) show that simple model-free methods can be highly effective in challenging high-dimensional continuous control tasks. In particular, Truncated Quantile Critics (TQC) achieves state-of-the-art asymptotic training performance on the MuJoCo benchmark with a distributional representation of critics; and Randomized Ensemble Double Q-Learning (REDQ) achieves high sample efficiency that is competitive with state-of-the-art model-based methods using a high update-to-data ratio and target randomization. In this paper, we propose a novel model-free algorithm, Aggressive Q-Learning with Ensembles (AQE), which improves the sample-efficiency performance of REDQ and the asymptotic performance of TQC, thereby providing overall state-of-the-art performance during all stages of training. Moreover, AQE is very simple, requiring neither distributional representation of critics nor target randomization. The effectiveness of AQE is further supported by our extensive experiments, ablations, and theoretical results.",random,0.0010024932,0
2203.14272,Discovering Human-Object Interaction Concepts via Self-Compositional Learning,"A comprehensive understanding of human-object interaction (HOI) requires detecting not only a small portion of predefined HOI concepts (or categories) but also other reasonable HOI concepts, while current approaches usually fail to explore a huge portion of unknown HOI concepts (i.e., unknown but reasonable combinations of verbs and objects). In this paper, 1) we introduce a novel and challenging task for a comprehensive HOI understanding, which is termed as HOI Concept Discovery; and 2) we devise a self-compositional learning framework (or SCL) for HOI concept discovery. Specifically, we maintain an online updated concept confidence matrix during training: 1) we assign pseudo-labels for all composite HOI instances according to the concept confidence matrix for self-training; and 2) we update the concept confidence matrix using the predictions of all composite HOI instances. Therefore, the proposed method enables the learning on both known and unknown HOI concepts. We perform extensive experiments on several popular HOI datasets to demonstrate the effectiveness of the proposed method for HOI concept discovery, object affordance recognition and HOI detection. For example, the proposed self-compositional learning framework significantly improves the performance of 1) HOI concept discovery by over 10% on HICO-DET and over 3% on V-COCO, respectively; 2) object affordance recognition by over 9% mAP on MS-COCO and HICO-DET; and 3) rare-first and non-rare-first unknown HOI detection relatively over 30% and 20%, respectively. Code is publicly available at https://github.com/zhihou7/HOI-CL.",random,0.003995512,0
2009.10656,E-BATCH: Energy-Efficient and High-Throughput RNN Batching,"Recurrent Neural Network (RNN) inference exhibits low hardware utilization due to the strict data dependencies across time-steps. Batching multiple requests can increase throughput. However, RNN batching requires a large amount of padding since the batched input sequences may largely differ in length. Schemes that dynamically update the batch every few time-steps avoid padding. However, they require executing different RNN layers in a short timespan, decreasing energy efficiency. Hence, we propose E-BATCH, a low-latency and energy-efficient batching scheme tailored to RNN accelerators. It consists of a runtime system and effective hardware support. The runtime concatenates multiple sequences to create large batches, resulting in substantial energy savings. Furthermore, the accelerator notifies it when the evaluation of a sequence is done, so that a new sequence can be immediately added to a batch, thus largely reducing the amount of padding. E-BATCH dynamically controls the number of time-steps evaluated per batch to achieve the best trade-off between latency and energy efficiency for the given hardware platform. We evaluate E-BATCH on top of E-PUR and TPU. In E-PUR, E-BATCH improves throughput by 1.8x and energy-efficiency by 3.6x, whereas in TPU, it improves throughput by 2.1x and energy-efficiency by 1.6x, over the state-of-the-art.",random,0.002414852,0
2005.03588,Learning Implicit Text Generation via Feature Matching,"Generative feature matching network (GFMN) is an approach for training implicit generative models for images by performing moment matching on features from pre-trained neural networks. In this paper, we present new GFMN formulations that are effective for sequential data. Our experimental results show the effectiveness of the proposed method, SeqGFMN, for three distinct generation tasks in English: unconditional text generation, class-conditional text generation, and unsupervised text style transfer. SeqGFMN is stable to train and outperforms various adversarial approaches for text generation and text style transfer.",random,0.0010752458,0
2203.13459,Semi-supervised and Deep learning Frameworks for Video Classification and Key-frame Identification,"Automating video-based data and machine learning pipelines poses several challenges including metadata generation for efficient storage and retrieval and isolation of key-frames for scene understanding tasks. In this work, we present two semi-supervised approaches that automate this process of manual frame sifting in video streams by automatically classifying scenes for content and filtering frames for fine-tuning scene understanding tasks. The first rule-based method starts from a pre-trained object detector and it assigns scene type, uncertainty and lighting categories to each frame based on probability distributions of foreground objects. Next, frames with the highest uncertainty and structural dissimilarity are isolated as key-frames. The second method relies on the simCLR model for frame encoding followed by label-spreading from 20% of frame samples to label the remaining frames for scene and lighting categories. Also, clustering the video frames in the encoded feature space further isolates key-frames at cluster boundaries. The proposed methods achieve 64-93% accuracy for automated scene categorization for outdoor image videos from public domain datasets of JAAD and KITTI. Also, less than 10% of all input frames can be filtered as key-frames that can then be sent for annotation and fine tuning of machine vision algorithms. Thus, the proposed framework can be scaled to additional video data streams for automated training of perception-driven systems with minimal training images.",random,0.0005324654,0
2606.11793,Scalable Deep Learning Framework for Global High-Resolution Land Use Reconstruction,"Uncertainty in the terrestrial carbon cycle remains a major constraint in climate projections, partly driven by the uncertainties affecting the land surface representation and variability in Earth system models. To address this limitation, we present a data-driven framework AI4Land, for generating high-resolution historical reconstructions and future projections of key land surface variables. The framework follows a two-phase approach using a U-Net architecture. In the first phase, which is the focus of this work, it reconstructs annual land use and land cover by integrating coarse-resolution scenario data with static geophysical features. In a planned second phase, the resulting high-resolution maps will be used to predict dynamic biophysical variables, particularly leaf area index, at finer temporal scales. Trained on Earth observation data, the models learn to reproduce spatially explicit and physically consistent land surface patterns, extending temporal coverage to periods lacking direct observations. AI4Land was developed and trained on MareNostrum5, demonstrating how GPU-accelerated HPC infrastructure enables global-scale climate AI pipelines. The final product is a suite of open-source emulators designed for real-time coupling with digital twin platforms, such as those developed under the Destination Earth initiative. By delivering realistic and evolving land surface conditions on demand, this work aims to reduce critical uncertainties and improve the predictive power of next-generation climate simulations.",random,0.0040930402,0
2602.11767,TSR: Trajectory-Search Rollouts for Multi-Turn RL of LLM Agents,"Advances in large language models (LLMs) are driving a shift toward using reinforcement learning (RL) to train agents from iterative, multi-turn interactions across tasks. However, multi-turn RL remains challenging as rewards are often sparse or delayed, and environments can be stochastic. In this regime, naive trajectory sampling can hinder exploitation and induce mode collapse. We propose TSR (Trajectory-Search Rollouts), a training-time approach that repurposes test-time scaling ideas for improved per-turn rollout generation. TSR performs lightweight tree-style search to construct high-quality trajectories by selecting high-scoring actions at each turn using state-based feedback. This improves rollout quality and stabilizes learning while remaining compatible with standard policy gradient optimizers, making TSR optimizer-agnostic. We instantiate TSR with best-of-N, beam, and shallow lookahead search, and pair it with PPO and GRPO, achieving up to 15% performance gains and more stable learning on Sokoban, FrozenLake, and WebShop tasks at a modest, one-time increase in training compute. By moving search from inference time to the rollout stage of training, TSR provides a modular and general mechanism for stronger multi-turn agent learning, complementary to existing frameworks and rejection-sampling-style selection methods.",random,0.00586979,0
1905.09618,Automatic Generation of Level Maps with the Do What's Possible Representation,"Automatic generation of level maps is a popular form of automatic content generation. In this study, a recently developed technique employing the {\em do what's possible} representation is used to create open-ended level maps. Generation of the map can continue indefinitely, yielding a highly scalable representation. A parameter study is performed to find good parameters for the evolutionary algorithm used to locate high-quality map generators. Variations on the technique are presented, demonstrating its versatility, and an algorithmic variant is given that both improves performance and changes the character of maps located. The ability of the map to adapt to different regions where the map is permitted to occupy space are also tested.",random,0.004953097,0
2601.17135,ConceptACT: Episode-Level Concepts for Sample-Efficient Robotic Imitation Learning,"Imitation learning enables robots to acquire complex manipulation skills from human demonstrations, but current methods rely solely on low-level sensorimotor data while ignoring the rich semantic knowledge humans naturally possess about tasks. We present ConceptACT, an extension of Action Chunking with Transformers that leverages episode-level semantic concept annotations during training to improve learning efficiency. Unlike language-conditioned approaches that require semantic input at deployment, ConceptACT uses human-provided concepts (object properties, spatial relationships, task constraints) exclusively during demonstration collection, adding minimal annotation burden. We integrate concepts using a modified transformer architecture in which the final encoder layer implements concept-aware cross-attention, supervised to align with human annotations. Through experiments on two robotic manipulation tasks with logical constraints, we demonstrate that ConceptACT converges faster and achieves superior sample efficiency compared to standard ACT. Crucially, we show that architectural integration through attention mechanisms significantly outperforms naive auxiliary prediction losses or language-conditioned models. These results demonstrate that properly integrated semantic supervision provides powerful inductive biases for more efficient robot learning.",random,0.005552468,0
