id,title,abstract,stratum,tfidf_proba,tfidf_pred
2402.13055,Identifying Semantic Induction Heads to Understand In-Context Learning,"Although large language models (LLMs) have demonstrated remarkable performance, the lack of transparency in their inference logic raises concerns about their trustworthiness. To gain a better understanding of LLMs, we conduct a detailed analysis of the operations of attention heads and aim to better understand the in-context learning of LLMs. Specifically, we investigate whether attention heads encode two types of relationships between tokens present in natural languages: the syntactic dependency parsed from sentences and the relation within knowledge graphs. We find that certain attention heads exhibit a pattern where, when attending to head tokens, they recall tail tokens and increase the output logits of those tail tokens. More crucially, the formulation of such semantic induction heads has a close correlation with the emergence of the in-context learning ability of language models. The study of semantic attention heads advances our understanding of the intricate operations of attention heads in transformers, and further provides new insights into the in-context learning of LLMs.",tfidf_pos,0.9899006,1
2402.09764,Aligning Crowd Feedback via Distributional Preference Reward Modeling,"Deep Reinforcement Learning is widely used for aligning Large Language Models (LLM) with human preference. However, the conventional reward modelling is predominantly dependent on human annotations provided by a select cohort of individuals. Such dependence may unintentionally result in skewed models that reflect the inclinations of these annotators, thereby failing to adequately represent the wider population's expectations. We propose the Distributional Preference Reward Model (DPRM), a simple yet effective framework to align large language models with diverse human preferences. To this end, we characterize multiple preferences by a categorical distribution and introduce a Bayesian updater to accommodate shifted or new preferences. On top of that, we design an optimal-transportation-based loss to calibrate DPRM to align with the preference distribution. Finally, the expected reward is utilized to fine-tune an LLM policy to generate responses favoured by the population. Our experiments show that DPRM significantly enhances the alignment of LLMs with population preference, yielding more accurate, unbiased, and contextually appropriate responses.",tfidf_pos,0.9089555,1
2602.11157,Response-Based Knowledge Distillation for Multilingual Jailbreak Prevention Unwittingly Compromises Safety,"Large language models (LLMs) are increasingly deployed worldwide, yet their safety alignment remains predominantly English-centric. This allows for vulnerabilities in non-English contexts, especially with low-resource languages. We introduce a novel application of knowledge distillation (KD) in the context of multilingual jailbreak prevention, examining its efficacy. We distill the refusal behaviors of a proprietary teacher model (OpenAI o1-mini) with Low-Rank Adaptation (LoRA) into three open-source student models: Meta-Llama-3-8B-Instruct, Gemma-2-2B-IT, and Qwen3-8B, using ~28,000 multilingual jailbreak prompts from XSafety via black-box response-based, parameter-efficient fine-tuning (PEFT). Evaluation on the MultiJail benchmark reveals a counterintuitive behavior: standard fine-tuning on the teacher's ``safe'' refusal data inadvertently increases Jailbreak Success Rate (JSR) for all student models, up to 16.6 percentage points. Our experiments reveal a divergent generalization to unseen languages during distillation, with varying outcomes depending on the base model. By removing a primary source of safety degradation, nuanced `boundary' refusals, we mitigate or even reverse safety declines in student models, although reductions in reasoning performance (GSM8K) persist. Overall, our exploratory study highlights the challenges and potential of KD as a technique for multilingual safety alignment, offering a foundation for future research in this direction.",tfidf_pos,0.9988696,1
2512.24560,Localized Calibrated Uncertainty in Code Language Models,"Large Language models (LLMs) can generate complicated source code from natural language prompts. However, LLMs can generate output that deviates from what the user wants, requiring supervision and editing. To support this process, we offer techniques to localize where generations might be misaligned from user intent. We first create a dataset of ""Minimal Intent Aligning Patches"" of repaired LLM generated programs. Each program uses test cases to verify correctness. After creating a dataset of programs, we measure how well various techniques can assign a well-calibrated probability to indicate which parts of code will be edited in a minimal patch (i.e., give a probability that corresponds with empirical odds it is edited). We compare white-box probing (where we propose a technique for efficient arbitrary-span querying), against black-box reflective and self-consistency based approaches. We find probes with a small supervisor model can achieve low calibration error and Brier Skill Score of approx 0.2 estimating edited lines on code generated by models many orders of magnitude larger. We discuss the generalizability of the techniques, and the connections to AI oversight and control, finding a probe trained only on code shows some signs of generalizing to natural language errors if new probability scaling is allowed.",tfidf_pos,0.77078784,1
2510.15946,"Fall into a Pit, Gain in a Wit: Cognitive-Guided Harmful Meme Detection via Misjudgment Risk Pattern Retrieval","Internet memes have emerged as a popular multimodal medium, yet they are increasingly weaponized to convey harmful opinions through subtle rhetorical devices like irony and metaphor. Existing detection approaches, including Multimodal Large Language Model (MLLM)-based techniques, struggle with these implicit expressions, leading to frequent misjudgments. This paper introduces PatMD, a novel approach that detects harmful memes by learning from and proactively mitigating these potential misjudgment risks. Our core idea is to move beyond superficial content-level matching and instead identify the underlying misjudgment risk patterns, proactively guiding the MLLMs to avoid known misjudgment pitfalls. We first construct a knowledge base where each meme is deconstructed into a misjudgment risk pattern explaining why it might be misjudged, either overlooking harmful undertones (false negative) or overinterpreting benign content (false positive). For a given target meme, PatMD retrieves relevant patterns and utilizes them to dynamically guide the MLLM's reasoning. Experiments on a benchmark of 6,626 memes across 5 harmful detection tasks show that PatMD outperforms state-of-the-art baselines, achieving an average of 8.30% improvement in F1-score and 7.71% improvement in accuracy, while exhibiting consistent robustness on unseen and adversarial memes.",tfidf_pos,0.5601694,1
2504.02911,Noiser: Bounded Input Perturbations for Attributing Large Language Models,"Feature attribution (FA) methods are common post-hoc approaches that explain how Large Language Models (LLMs) make predictions. Accordingly, generating faithful attributions that reflect the actual inner behavior of the model is crucial. In this paper, we introduce Noiser, a perturbation-based FA method that imposes bounded noise on each input embedding and measures the robustness of the model against partially noised input to obtain the input attributions. Additionally, we propose an answerability metric that employs an instructed judge model to assess the extent to which highly scored tokens suffice to recover the predicted output. Through a comprehensive evaluation across six LLMs and three tasks, we demonstrate that Noiser consistently outperforms existing gradient-based, attention-based, and perturbation-based FA methods in terms of both faithfulness and answerability, making it a robust and effective approach for explaining language model predictions.",tfidf_pos,0.78366804,1
1906.04341,What Does BERT Look At? An Analysis of BERT's Attention,"Large pre-trained neural networks such as BERT have had great recent success in NLP, motivating a growing body of research investigating what aspects of language they are able to learn from unlabeled data. Most recent analysis has focused on model outputs (e.g., language model surprisal) or internal vector representations (e.g., probing classifiers). Complementary to these works, we propose methods for analyzing the attention mechanisms of pre-trained models and apply them to BERT. BERT's attention heads exhibit patterns such as attending to delimiter tokens, specific positional offsets, or broadly attending over the whole sentence, with heads in the same layer often exhibiting similar behaviors. We further show that certain attention heads correspond well to linguistic notions of syntax and coreference. For example, we find heads that attend to the direct objects of verbs, determiners of nouns, objects of prepositions, and coreferent mentions with remarkably high accuracy. Lastly, we propose an attention-based probing classifier and use it to further demonstrate that substantial syntactic information is captured in BERT's attention.",tfidf_pos,0.94984174,1
2509.23783,Falcon: A Cross-Modal Evaluation Dataset for Comprehensive Safety Perception,"Existing methods for evaluating the harmfulness of content generated by large language models (LLMs) have been well studied. However, approaches tailored to multimodal large language models (MLLMs) remain underdeveloped and lack depth. This work highlights the crucial role of visual information in moderating content in visual question answering (VQA), a dimension often overlooked in current research. To bridge this gap, we introduce Falcon, a large-scale vision-language safety dataset containing 57,515 VQA pairs across 13 harm categories. The dataset provides explicit annotations for harmful attributes across images, instructions, and responses, thereby facilitating a comprehensive evaluation of the content generated by MLLMs. In addition, it includes the relevant harm categories along with explanations supporting the corresponding judgments. We further propose FalconEye, a specialized evaluator fine-tuned from Qwen2.5-VL-7B using the Falcon dataset. Experimental results demonstrate that FalconEye reliably identifies harmful content in complex and safety-critical multimodal dialogue scenarios. It outperforms all other baselines in overall accuracy across our proposed Falcon-test dataset and two widely-used benchmarks-VLGuard and Beavertail-V, underscoring its potential as a practical safety auditing tool for MLLMs.",tfidf_pos,0.82997,1
2605.30251,"Same Evidence, Different Answers: Canonical-Context On-Policy Distillation for Multi-Turn Language Models","Large language models (LLMs) often solve a task when all instructions are given in a single prompt, but fail when the same information is revealed gradually across turns. When a clean FULL prompt and a RAW-SHARDED conversation contain the same complete user evidence, the model should still arrive at the same answer. We argue that a key reason for this gap is self-anchored drift: responses produced under partial information introduce unsupported assumptions, and those assumptions later distort the final answer. To reduce this effect, we propose Canonical-Context On-Policy Distillation (CCOPD). During training, the same base model is used in two roles: a frozen teacher conditioned on the clean FULL prompt and a trainable student that receives the same evidence incrementally through a multi-turn conversation; CCOPD aligns the student's behavior on its own trajectories with the teacher's canonical full-context behavior. Trained only on math problem conversations, CCOPD yields a 32\% average relative improvement in RAW-SHARDED performance over the original base model across math and five zero-shot out-of-domain task families, while largely preserving full-context performance. Further analyses suggest that CCOPD strengthens grounding in user evidence and reduces sensitivity to contamination from earlier assistant turns.",tfidf_pos,0.70162773,1
2506.19823,Persona Features Control Emergent Misalignment,"Understanding how language models generalize behaviors from their training to a broader deployment distribution is an important problem in AI safety. Betley et al. discovered that fine-tuning GPT-4o on intentionally insecure code causes ""emergent misalignment,"" where models give stereotypically malicious responses to unrelated prompts. We extend this work, demonstrating emergent misalignment across diverse conditions, including reinforcement learning on reasoning models, fine-tuning on various synthetic datasets, and in models without safety training. To investigate the mechanisms behind this generalized misalignment, we apply a ""model diffing"" approach using sparse autoencoders to compare internal model representations before and after fine-tuning. This approach reveals several ""misaligned persona"" features in activation space, including a toxic persona feature which most strongly controls emergent misalignment and can be used to predict whether a model will exhibit such behavior. Additionally, we investigate mitigation strategies, discovering that fine-tuning an emergently misaligned model on just a few hundred benign samples efficiently restores alignment.",tfidf_pos,0.9999167,1
2405.01561,Rapid Mobile App Development for Generative AI Agents on MIT App Inventor,"The evolution of Artificial Intelligence (AI) stands as a pivotal force shaping our society, finding applications across diverse domains such as education, sustainability, and safety. Leveraging AI within mobile applications makes it easily accessible to the public, catalyzing its transformative potential. In this paper, we present a methodology for the rapid development of AI agent applications using the development platform provided by MIT App Inventor. To demonstrate its efficacy, we share the development journey of three distinct mobile applications: SynchroNet for fostering sustainable communities; ProductiviTeams for addressing procrastination; and iHELP for enhancing community safety. All three applications seamlessly integrate a spectrum of generative AI features, leveraging OpenAI APIs. Furthermore, we offer insights gleaned from overcoming challenges in integrating diverse tools and AI functionalities, aiming to inspire young developers to join our efforts in building practical AI agent applications.",tfidf_pos,0.601166,1
2503.22038,Debate-Driven Multi-Agent LLMs for Phishing Email Detection,"Phishing attacks remain a critical cybersecurity threat. Attackers constantly refine their methods, making phishing emails harder to detect. Traditional detection methods, including rule-based systems and supervised machine learning models, either rely on predefined patterns like blacklists, which can be bypassed with slight modifications, or require large datasets for training and still can generate false positives and false negatives. In this work, we propose a multi-agent large language model (LLM) prompting technique that simulates debates among agents to detect whether the content presented on an email is phishing. Our approach uses two LLM agents to present arguments for or against the classification task, with a judge agent adjudicating the final verdict based on the quality of reasoning provided. This debate mechanism enables the models to critically analyze contextual cue and deceptive patterns in text, which leads to improved classification accuracy. The proposed framework is evaluated on multiple phishing email datasets and demonstrate that mixed-agent configurations consistently outperform homogeneous configurations. Results also show that the debate structure itself is sufficient to yield accurate decisions without extra prompting strategies.",tfidf_pos,0.57604486,1
2210.07652,Enabling Classifiers to Make Judgements Explicitly Aligned with Human Values,"Many NLP classification tasks, such as sexism/racism detection or toxicity detection, are based on human values. Yet, human values can vary under diverse cultural conditions. Therefore, we introduce a framework for value-aligned classification that performs prediction based on explicitly written human values in the command. Along with the task, we propose a practical approach that distills value-aligned knowledge from large-scale language models (LLMs) to construct value-aligned classifiers in two steps. First, we generate value-aligned training data from LLMs by prompt-based few-shot learning. Next, we fine-tune smaller classification models with the generated data for the task. Empirical results show that our VA-Models surpass multiple baselines by at least 15.56% on the F1-score, including few-shot learning with OPT-175B and existing text augmentation methods. We suggest that using classifiers with explicit human value input improves both inclusivity & explainability in AI.",tfidf_pos,0.6663968,1
2602.13320,Information Fidelity in Tool-Using LLM Agents: A Martingale Analysis of the Model Context Protocol,"As AI agents powered by large language models (LLMs) increasingly use external tools for high-stakes decisions, a critical reliability question arises: how do errors propagate across sequential tool calls? We introduce the first theoretical framework for analyzing error accumulation in Model Context Protocol (MCP) agents, proving that cumulative distortion exhibits linear growth and high-probability deviations bounded by $O(\sqrt{T})$. This concentration property ensures predictable system behavior and rules out exponential failure modes. We develop a hybrid distortion metric combining discrete fact matching with continuous semantic similarity, then establish martingale concentration bounds on error propagation through sequential tool interactions. Experiments across Qwen2-7B, Llama-3-8B, and Mistral-7B validate our theoretical predictions, showing empirical distortion tracks the linear trend with deviations consistently within $O(\sqrt{T})$ envelopes. Key findings include: semantic weighting reduces distortion by 80\%, and periodic re-grounding approximately every 9 steps suffices for error control. We translate these concentration guarantees into actionable deployment principles for trustworthy agent systems.",tfidf_pos,0.8272857,1
2606.00642,Hidden Thoughts Are Not Secret: Reasoning Trace Exposure in LLMs,"Reasoning traces have become a valuable form of learning signals for improving and transferring the capabilities of large language models. In particular, detailed traces can help distill reasoning behavior from stronger teacher models into weaker student models. The value of capability transfer has motivated many deployed systems with reasoning models to hide raw internal traces and expose at most summaries and answers to users. As a result, we ask whether such interface-level trace hiding prevents users from obtaining useful reasoning supervision through prompting. We study this question with Reasoning Exposure Prompting (REP), a lightweight in-context elicitation method that uses shadow-model-generated demonstrations wrapped in auxiliary code-like formats to raise user-visible reasoning traces from a victim model. Across the common reasoning dataset, different victim models, and different student model distillation, REP substantially increases similarity between exposed and REP-conditioned internal traces while preserving useful reasoning signals.",tfidf_pos,0.7010244,1
2405.16436,Provably Mitigating Overoptimization in RLHF: Your SFT Loss is Implicitly an Adversarial Regularizer,"Aligning generative models with human preference via RLHF typically suffers from overoptimization, where an imperfectly learned reward model can misguide the generative model to output undesired responses. We investigate this problem in a principled manner by identifying the source of the misalignment as a form of distributional shift and uncertainty in learning human preferences. To mitigate overoptimization, we first propose a theoretical algorithm that chooses the best policy for an adversarially chosen reward model; one that simultaneously minimizes the maximum likelihood estimation of the loss and a reward penalty term. Here, the reward penalty term is introduced to prevent the policy from choosing actions with spurious high proxy rewards, resulting in provable sample efficiency of the algorithm under a partial coverage style condition. Moving from theory to practice, the proposed algorithm further enjoys an equivalent but surprisingly easy-to-implement reformulation. Using the equivalence between reward models and the corresponding optimal policy, the algorithm features a simple objective that combines: (i) a preference optimization loss that directly aligns the policy with human preference, and (ii) a supervised learning loss that explicitly imitates the policy with a (suitable) baseline distribution. In the context of aligning large language models (LLM), this objective fuses the direct preference optimization (DPO) loss with the supervised fine-tuning (SFT) loss to help mitigate the overoptimization towards undesired responses, for which we name the algorithm Regularized Preference Optimization (RPO). Experiments of aligning LLMs demonstrate the improved performance of RPO compared with DPO baselines. Our work sheds light on the interplay between preference optimization and SFT in tuning LLMs with both theoretical guarantees and empirical evidence.",tfidf_pos,0.99707276,1
2501.18841,Trading Inference-Time Compute for Adversarial Robustness,"We conduct experiments on the impact of increasing inference-time compute in reasoning models (specifically OpenAI o1-preview and o1-mini) on their robustness to adversarial attacks. We find that across a variety of attacks, increased inference-time compute leads to improved robustness. In many cases (with important exceptions), the fraction of model samples where the attack succeeds tends to zero as the amount of test-time compute grows. We perform no adversarial training for the tasks we study, and we increase inference-time compute by simply allowing the models to spend more compute on reasoning, independently of the form of attack. Our results suggest that inference-time compute has the potential to improve adversarial robustness for Large Language Models. We also explore new attacks directed at reasoning models, as well as settings where inference-time compute does not improve reliability, and speculate on the reasons for these as well as ways to address them.",tfidf_pos,0.78531814,1
2503.10706,SciFi-Benchmark: Leveraging Science Fiction To Improve Robot Behavior,"Given the recent rate of progress in artificial intelligence (AI) and robotics, a tantalizing question is emerging: would robots controlled by emerging AI systems be strongly aligned with human values? In this work, we propose a scalable way to probe this question by generating a benchmark spanning the key moments in 824 major pieces of science fiction literature (movies, tv, novels and scientific books) where an agent (AI or robot) made critical decisions (good or bad). We use a state-of-the-art LLM's recollection of each key moment to generate questions in similar situations, the decisions made by the agent, and alternative decisions it could have made (good or bad). We then measure an approximation of how well models align with human values on a set of human-voted answers. We also generate rules that can be automatically improved via an amendment process in order to generate the first Sci-Fi inspired constitutions for promoting ethical behavior in AIs and robots in the real world. Our first finding is that modern LLMs paired with constitutions turn out to be well-aligned with human values (95.8%), contrary to unsettling decisions typically made in Sci-Fi (only 21.2% alignment). Secondly, we find that generated constitutions substantially increase alignment compared to the base model (79.4% to 95.8%), and show resilience to an adversarial prompt setting (23.3% to 92.3%). Additionally, we find that those constitutions are among the top performers on the ASIMOV Benchmark which is derived from real-world images and hospital injury reports. Sci-Fi-inspired constitutions are thus highly aligned and applicable in real-world situations. We release SciFi-Benchmark: a large-scale dataset to advance robot ethics and safety research. It comprises 9,056 questions and 53,384 answers generated through a novel LLM-introspection process, in addition to a smaller human-labeled evaluation set.",tfidf_pos,0.9738837,1
2604.17215,Continual Safety Alignment via Gradient-Based Sample Selection,"Large language models require continuous adaptation to new tasks while preserving safety alignment. However, fine-tuning on even benign data often compromises safety behaviors, including refusal of harmful requests, truthfulness, and commonsense reasoning. We investigate which training samples cause alignment drift through a data-centric lens. Our empirical analysis shows samples contribute unequally: high-gradient samples cause greater safety degradation and drive models toward pretrained distributions, while moderate-gradient samples enable task learning with minimal alignment loss. We propose gradient-based sample selection that filters high-gradient samples during fine-tuning. Across multiple model families on continual domain tasks, our method substantially improves alignment preservation while maintaining competitive task performance, without requiring curated safe data or architectural modifications. Our method is robust across selection ratios, task orderings, and diverse attack benchmarks.",tfidf_pos,0.9770023,1
